Título, Precio 
TITULO: Anbalulu Magnetic Tiles for Kids, Stacking Blocks, Preschool Stem Construction Building Set 100 Pcs,PRECIO: €39.
TITULO: Don Clemente Autentica Loteria Mexican Bingo Set 20 Tablets Colorful and Educational,PRECIO: €7.
TITULO: Pokemon Battle Academy 2 Board Game,PRECIO: €14.
TITULO: FITZ - ¡Dios Mio! Bilingual Fun Card Game - Juegos de mesa en español - A Comedy Party Tarjeta Game NSFW - 350 Muy Graciosa Cards - Spanish Board Game - Party Games,PRECIO: €24.
TITULO: USAOPOLY TAPPLE® Word Game | Fast-Paced Family Board Game | Choose a Category & Race Against The Timer to be The Last Player | Learning Game Great for All Ages,PRECIO: €19.
TITULO: Lingle 15Inch Wooden Folding Chess Set with 3'' Kh Staunton Chess Pieces - Maple & Walnut Inlay Board Game,PRECIO: €22.
TITULO: Twister Ultimate: Bigger Mat, More Colored Spots, Family, Kids Party Game Age 6+; Compatible with Alexa (Amazon Exclusive),PRECIO: €21.
TITULO: Elite Sportz Ring Toss Games for Kids - Outdoor Yard Game for Adults & Family - Backyard Toys, Outdoor Games, Yard Games, Backyard Games, Lawn Games, Outdoor Toys For Kids Ages 4-8, Outdoor Toys,PRECIO: €19.
TITULO: IJO Double Sided Dart Board 29 inch with 12 Sticky Balls-Boys Girls Toys-Indoor/Outdoor Target Game-Party Games for 3 4 5 6 7 8 9 10 11 12 Years Old Boys Girls Childrens,PRECIO: €11.
TITULO: Wireless Retro Game Console, Equipped with 64G TF Card Plug and Play, Nostalgia Game Stick 4K 20000+ Games Built-in, 9 Classic Emulators, with Dual 2.4G Wireless Controllers, White,PRECIO: €44.
TITULO: YoYa Toys Beadeez Squishy Stress Relief Balls (3 Pack) - Colorful Squeeze Stretch Balls with Water Beads - Sensory Fidget Toys for Kids and Adults - Increase Focus, Great for ADHD, Autism, Anxiety,PRECIO: €15.
TITULO: El Juego Perfecto (The Perfect Game) Audio English & Spanish with Spanish Subtitles,PRECIO: €19.
TITULO: Jalunth Ball Catch Set Games Toss Paddle - Beach Toys Back Yard Outdoor Pool Backyard Throw Sticky Set Age 3 4 5 6 7 8 9 10 11 12 Years Old Boys Girls Kids Adults Family Outside Easter Gifts Green,PRECIO: €26.
TITULO: ORCHARD TOYS Moose Games Magic Maths Game. an exciting and spellbinding Math Game. for Ages 5-7 and for 2-4 Players,PRECIO: €6.
TITULO: Wireless Retro Game Console, Plug and Play Nostalgia Video Game Stick 4K 10000+ Games Built-in, 9 Classic Emulators, 64G, with Dual 2.4GHz Wireless Controllers Black,PRECIO: €46.
TITULO: STEAM STUDIO Premium Magnetic Tiles Rivets & Large Strong Magnets, BPA Free Kids Toys, Building Blocks Toddler Toys for Boys Girls, Building & Construction Toys (110 pcs),PRECIO: €49.
TITULO: IJO 4 Pack LED Light Airplane Toys-17.5" Large Throwing Foam Plane-2 Flight Modes Glider Plane-Outdoor Flying Toys for Kids-Flying Toys Gift for Boys Girls 3 4 5 6 7 8 9 Years Old,PRECIO: €20.
TITULO: Regal Games - Premium Double 12 Mexican Train Dominoes in Collector’s Tin - Colored Dot Dominoes Game Set, Family-Friendly - 91 Tiles, 4 Metal Trains, Wooden Hub - 2-8 Players Ages 8+,PRECIO: €29.
TITULO: Bluey - Shadowlands Board Game - Family Game Night, Unpredictable - Engaging Fun for All - Collect All 5 Cupcake Cards | 2-4 Players | for Ages 3+, Multicolor, 13011,PRECIO: €34.
TITULO: UNO Minecraft Card Game Videogame-Themed Collectors Deck 112 Cards With Character Images, Gift For Fans Ages 7 Years Old & Up,PRECIO: €6.
TITULO: Great Boy Handheld Game Console for Kids Preloaded 270 Classic Retro Games with 3.0'' Color Display and Gamepad Rechargeable Arcade Gaming Player (Blue),PRECIO: €32.
TITULO: Rechargeable Game Activity Cube - 9 Fun Brain & Memory Games - Cool Toys for Boys and Girls - Christmas/Birthday Gifts for Ages 6-12+ Year Old Kids Tweens & Teens - Best Boy & Girl Toy Gift Ideas,PRECIO: €39.
TITULO: Classic Operation Game,PRECIO: €14.
TITULO: Jenga Classic Game with Genuine Hardwood Blocks, Stacking Tower Game for 1 or More Players, Kids Ages 6 and Up,PRECIO: €12.
TITULO: Regal Games - Reversible Wooden Board for Chess, Checkers & Tic-Tac-Toe - 24 Interlocking Wooden Checkers and 32 Standard Chess Pieces - for Age 8 to Adult for Family Fun,PRECIO: €22.
TITULO: Connect 4 Classic Grid , 4 in a Row Game, Strategy Board Games for Kids, 2 Player . for Family and Kids, Ages 6 and Up,PRECIO: €7.
TITULO: Yasola Claw Machine for Kids,Mini Vending Machines, Arcade Candy Claw Game Prizes Grabber Toy for Home,Prize Dispenser Toys for Girls with Lights Sound（Not Incloud Candy & Toy ）,PRECIO: €44.
TITULO: Hedbanz Picture Guessing Board Game New Edition, for Families and Kids Ages 8 and up,PRECIO: €13.
TITULO: SEQUENCE- Original SEQUENCE Game with Folding Board, Cards and Chips by Jax ( Packaging may Vary ) White, 10.3" x 8.1" x 2.31",PRECIO: €13.
TITULO: Conversation Game in Spanish - Why Don't We - Conversar y Conocerse - 120 Cards with Questions, Games, Conversations & More. Fun Game for Adults and Gift for Couples.,PRECIO: €22.
TITULO: Twister Party Classic Board Game for 2 or More Players, Indoor and Outdoor Game for Kids 6 and Up, Packaging may vary,PRECIO: €15.
TITULO: Melissa & Doug Suspend Family Game (31 pcs) - Wire Balance Game, Family Game Night Activities, For Kids Ages 8+,PRECIO: €17.
TITULO: BUSCBEAR Toy 1000 Pieces Jigsaw Puzzle Game Oil Painting Collection Klimt The Kiss,PRECIO: €14.
TITULO: Retro Classic Game Console Wireless HDMI Output System，Built in 10000+ Classic Handheld Video Games 2.4G Wireless Controllers, 9 Emulator Consoles,PRECIO: €49.
TITULO: Squid Toys Action Figures Building Kit, Popular TV Building Sets, with 6 Cute Characters, Collectible Model, Valentines Day Gifts for Kids or Friends (436 Pieces),PRECIO: €13.
TITULO: Tragos En Español Game for Latinos - Relatable Hilarious Cultural Spanglish Card Game - Gift for Adults, College Students, Families &amp; Party Animals - Juegos De Mesa para Adultos,PRECIO: €22.
TITULO: UNO Card Game for Family Night, Travel Game & Gift for Kids In a Collectible Storage Tin for 2-10 Players [Amazon Exclusive],PRECIO: €10.
TITULO: AUSPDICE Dice Rolling Tower and Tray Retro Castle Mold Color for Tabletop Games, D&D and RPG Games (Bronze Color),PRECIO: €59.
TITULO: Catcrafter ABC Flash Cards Toddler Toys - Alphabet Number Clock Wooden Letter Puzzle Matching Game Montessori Preschool Educational Toys for Kids Boys Girls Ages 1-3 4+ (36 Cards & 36 Blocks Included),PRECIO: €19.
TITULO: yeesport Speed Stacking Cups Game: 24pcs Cup Stacking Set, Sports Stacking Cups Speed Training for Party Challenge Competition Travel Game, Gift Idea for Stack Games Lover (Red & Purple),PRECIO: €17.
TITULO: Bey Battling Top Stadium Blade Battle Set, 6 Metal Fusion Spinning Tops 2 Launchers 1 Arena Combat Game, Toy Gift for Kids Boys Ages 6+…,PRECIO: €34.
TITULO: Microsoft Xbox One Kinect Sensor Bar [Xbox One](Renewed),PRECIO: €50.
TITULO: Pokémon TCG: Scarlet & Violet - Paldea Evolved Booster Display Box,PRECIO: €114.
TITULO: Hasbro Gaming Jenga Wooden Blocks Stacking Tumbling Tower Kids Game Ages 6 and Up (Amazon Exclusive),PRECIO: €16.
TITULO: UNO Card Game (2 Pack),PRECIO: €10.
TITULO: Wireless Retro Game Console,Retro Game Stick,Nostalgia Stick Game,4K HDMI Output,Plug and Play Video Game Stick Built in 10000+ Games,9 Classic Emulators, with Dual 2.4G Wireless Controllers(64G),PRECIO: €53.
TITULO: Wireless Retro Game Console,Retro Game Stick,Nostalgia Stick Game,4K HDMI Output,Plug and Play Video Game Stick Built in 10000+ Games,9 Classic Emulators, with Dual 2.4G Wireless Controllers(64G),PRECIO: €44.
TITULO: Noah's Ark Board Game, Don't Rock The Boat, Strategy Balancing Game, Hand-Eye Coordination, Religious Stacking Educational Board Game with Animal Toys,PRECIO: €29.
TITULO: Minute of Fun Party Game - 237 Minute to Win It Challenges for Duels, Teams, Parties, Teens, Family, Friends, Party Games, Kids, Adults, Home, School, Travel 2-12 Players Mom's Choice Awards Winner,PRECIO: €24.
TITULO: Regal Games - Deluxe Bingo Set - Includes Bingo Cage, Master Board, 18 Mixed Cards, 75 Calling Balls, Colorful Chips - Ideal for Large Groups, Parties,PRECIO: €19.
TITULO: Eric Benjamin Brown Televisa Juego de Preguntas 100 Mexicanos Dijeron,PRECIO: €47.
TITULO: Arcade Game Console Pandora Box Built in 10000 Retro Games 4K HDMI 64G 2 Player Game Emulator Console Joystick with Trackball No Network Plug and Play TV Video Jame Gamepad Support Multiple Emulators,PRECIO: €109.
TITULO: Bottleboom Shooting Game Toys for Boys Age 5 6 7 8 9 10+ Years Old,Foam Popper Guns for 2 Player,Electric Shooting Target & Air Blaster with 24 Foam Bullet Balls Birthday Gift for Kids Girls,PRECIO: €21.
TITULO: Juego De Patriotas (Ed.Especial) [Import espagnol],PRECIO: €14.
TITULO: Stranger Things Upside Down Board Game | Strategy Game | Tabletop Miniatures Game | Cooperative Game for Kids and Adults | Ages 12+ | 2-4 Players | Average Playtime 60 Minutes | Made by CMON,PRECIO: €49.
TITULO: Toss and Catch Ball Games for Kids-Paddles Ball Catch Lawn Game-Upgraded Version Outdoor Sports Toys for Kids/Family, Boys and Girls Gifts,PRECIO: €23.
TITULO: Kids Toys - Beach Toys - Outdoor Games for Kids, Toss and Catch Ball Set with 6 Paddles 3 Balls, Outdoor Toys for 3 4 5 6 7 8+ Year Old Boys Girls Birthday Easter Gifts for Kids,PRECIO: €25.
TITULO: QianDanS Wooden Activity Cubes 5-in-1 Baby Montessori Toys for 1 Year Old，Educational Toys for 1-2 Year Old Sensory Toys for Toddlers 1-3 Gifts for 1 Year Old Boys and Girls,PRECIO: €39.
TITULO: Arachnid Cricket Pro 800 Electronic Dartboard with NylonTough Segments for Improved Durability and Playability and Micro-Thin Segment Dividers for ReducedBounce-Outs , Black,PRECIO: €249.
TITULO: TOCULAB Dance Mat for Kids, Music Mat for Girls Electronic Dance Mats with Non-Slip Socks, LED Lights, 7 Game Modes, Built-in Music, Adjustable Volume, 3 Challenge Levels Birthday Ages 4-10,PRECIO: €49.
